{"activity":{"correlationId":"urn:uuid:517cbdca-941d-4887-b6cc-6477de9d4461","name":"customer-address-change"},"actor":{"id":"urn:acme:harness:prod","type":"system"},"agent":{"id":"contract-agent","version":"17"},"controlSet":{"id":"customer-write-v4","version":"4"},"createdAt":"2026-09-18T04:28:33Z","evidenceId":"urn:uuid:66905935-2ee1-4fb0-a08d-ad58d567fdb7","objects":[{"contentType":"text/plain","role":"instruction-set","uri":"urn:uuid:1f5d71d9-8898-4387-9c39-5b97676efd84"},{"contentType":"application/json","role":"tool-manifest","uri":"urn:uuid:c5648445-7610-462a-82b1-6b553b560fe9"},{"contentType":"application/json","role":"execution-policy","uri":"urn:uuid:daf28ad1-321d-4e34-aff3-6653b0eab6c7"},{"contentType":"application/json","role":"control-set","uri":"urn:uuid:96e864c5-4380-4b68-bda7-735f41943251"},{"contentType":"application/jwt","role":"authority","uri":"urn:uuid:9e195d68-0825-4e47-a115-7a8aa248b7a7"}],"schemaName":"AgentControlArtifact","schemaVersion":"1"}